<!--Les attributs entre parenthèses sont en options -->

<?xml version="1.0" encoding="UTF-8"?>
<!DOCTYPE JN10 SYSTEM "DTD_JN10.dtd">

<jeuxNintendo>

		<div id="navigation">
            <a href="fortnite_page.xhtml">
            <picture src="../../Images/Navigation/arrows_left.png" alt="Fléche Arrière" title="Arrière" width="4%" height="4%"/></a>
            <a href="index.html">
            <picture src="../../Images/Navigation/page_index.png" alt="page_index" title="Home" width="4%" height="4%"/></a>
            <a href="pokemon_epee_page.xhtml">
            <picture src="../../Images/Navigation/arrows_right.png" alt="Fléche Avant" title="Avant" width="4%" height="4%"/></a>
        </div>

	<Information id="information">

		<game>Animal Crossing: New Horizons</game>

		<div>
			<gender><span>Genre :</span> Simulation de vie<gender>
			<releaseDate>
				<span href="color-">Date de sortie : </span>
				<day>20</day>/
				<month>03</month>/
				<year>2020</year>
			</releaseDate>
			<gameMode><span href="color-">Jouabilité :</span> de 1 à 8 joueurs</gameMode>
			<engine><span href="color-">Moteur du jeu :</span> LunchPack</engine>
			<evaluation><span href="color-">Classification :</span> PEGI 3</evaluation>
			<sales><span href="color-">Ventes :</span> 31 180 000</sales>
		</div>

	</Information>

	<Creation id="creation">

		<Developer><span href="color-">Développeur :</span>Nintendo EPD</Developer>
		<!-- <Developer (id="")> </Developer> -->
		<Editor><span href="color-">Éditeur :</span>Nintendo</Editor>
		<!-- <Editor (id="")> </Editor> -->
		<Director><span href="color-">Directeur :</span>Aya Kyogoku</Director>
		<!-- <Director (id="")> </Director> -->
		<Scriptwriter><span href="color-">Scénariste :</span>Nintendo</Scriptwriter>
		<!-- <Scriptwriter (id="")> </Scriptwriter> -->
		<Composer><span href="color-">Compositeur :</span>Sayako Doi, Yasuaki Iwata, Shinobu Nagata, Masato Ohashi, Yumi Takahashi et Kazumi Totaka</Composer>
		<!-- <Composer (id="")> </Composer> -->
		<Producer><span href="color-">Producteur :</span>Hisashi Nogami</Producer>
		<!-- <Producer (id="")> </Producer> -->

	</Creation>

    <a>
		<Picture src="../../Images/Collection/Logo_Animal_Crossing.png" alt="Logo Animal Crossing" 
             title="Logo Animal Crossing" width="40%" height="40%"/></a>
		     <!-- <Picture (id="") src="" alt="" (title="")/> -->

  	<p><a href="https://fr.wikipedia.org/wiki/Animal_Crossing:_New_Horizons">Sources</a></p>
</jeuxNintendo>
